{
  "$schema": "https://json-schema.org/draft/2020-12/schema",
  "$id": "https://github.com/reacher-z/Awesome-CUA/blob/main/schemas/resource.schema.json",
  "title": "Awesome CUA resource",
  "description": "One resource, not one project. Bibliographic verification and editorial curation are different states.",
  "type": "object",
  "required": [
    "id",
    "name",
    "kind",
    "url",
    "aliases",
    "environments",
    "topics",
    "scope",
    "summary",
    "review_status",
    "published_at",
    "updated_at",
    "authors",
    "identifiers",
    "links",
    "relations",
    "licenses",
    "evidence",
    "last_verified_at",
    "notes",
    "details"
  ],
  "properties": {
    "id": {
      "type": "string",
      "pattern": "^(arxiv:|github:|url:|component:|organization:)[^\\s]+$"
    },
    "name": {
      "type": "string",
      "minLength": 1
    },
    "kind": {
      "enum": [
        "agent",
        "benchmark",
        "company",
        "dataset",
        "framework",
        "infrastructure",
        "learning",
        "model",
        "paper",
        "product",
        "survey",
        "tool"
      ]
    },
    "url": {
      "type": "string",
      "format": "uri",
      "pattern": "^https://"
    },
    "aliases": {
      "type": "array",
      "items": {
        "type": "string"
      },
      "uniqueItems": true
    },
    "environments": {
      "type": "array",
      "minItems": 1,
      "uniqueItems": true,
      "items": {
        "enum": [
          "android",
          "cross-platform",
          "desktop",
          "ios",
          "linux",
          "macos",
          "unspecified",
          "web",
          "windows"
        ]
      }
    },
    "topics": {
      "type": "array",
      "items": {
        "type": "string"
      },
      "uniqueItems": true
    },
    "scope": {
      "enum": [
        "core",
        "adjacent",
        "relevance_pending"
      ]
    },
    "summary": {
      "type": [
        "string",
        "null"
      ]
    },
    "review_status": {
      "enum": [
        "curated",
        "metadata_verified"
      ]
    },
    "published_at": {
      "type": [
        "string",
        "null"
      ],
      "format": "date"
    },
    "updated_at": {
      "type": [
        "string",
        "null"
      ],
      "format": "date"
    },
    "authors": {
      "type": "array",
      "items": {
        "type": "string"
      }
    },
    "identifiers": {
      "type": "object",
      "additionalProperties": {
        "type": "string"
      }
    },
    "links": {
      "type": "array",
      "minItems": 1,
      "items": {
        "type": "object",
        "required": [
          "rel",
          "url"
        ],
        "properties": {
          "rel": {
            "type": "string"
          },
          "url": {
            "type": "string",
            "format": "uri",
            "pattern": "^https://"
          }
        },
        "additionalProperties": false
      }
    },
    "relations": {
      "type": "array",
      "items": {
        "type": "object",
        "required": [
          "type",
          "target_id",
          "evidence_url"
        ],
        "properties": {
          "type": {
            "enum": [
              "introduced_by",
              "published_by",
              "component_of",
              "uses",
              "evaluates",
              "trained_on",
              "variant_of",
              "documented_by"
            ]
          },
          "target_id": {
            "type": "string"
          },
          "evidence_url": {
            "type": "string",
            "format": "uri",
            "pattern": "^https://"
          }
        },
        "additionalProperties": false
      }
    },
    "licenses": {
      "type": "object",
      "required": [
        "code",
        "data",
        "weights",
        "document"
      ],
      "properties": {
        "code": {
          "type": [
            "object",
            "null"
          ],
          "required": [
            "declared",
            "url",
            "retrieved_at",
            "basis"
          ],
          "properties": {
            "declared": {
              "oneOf": [
                {
                  "type": "string"
                },
                {
                  "type": "array",
                  "minItems": 1,
                  "items": {
                    "type": "string"
                  }
                }
              ]
            },
            "url": {
              "type": "string",
              "format": "uri",
              "pattern": "^https://"
            },
            "retrieved_at": {
              "type": "string",
              "format": "date-time"
            },
            "basis": {
              "type": "string"
            }
          },
          "additionalProperties": false
        },
        "data": {
          "type": [
            "object",
            "null"
          ],
          "required": [
            "declared",
            "url",
            "retrieved_at",
            "basis"
          ],
          "properties": {
            "declared": {
              "oneOf": [
                {
                  "type": "string"
                },
                {
                  "type": "array",
                  "minItems": 1,
                  "items": {
                    "type": "string"
                  }
                }
              ]
            },
            "url": {
              "type": "string",
              "format": "uri",
              "pattern": "^https://"
            },
            "retrieved_at": {
              "type": "string",
              "format": "date-time"
            },
            "basis": {
              "type": "string"
            }
          },
          "additionalProperties": false
        },
        "weights": {
          "type": [
            "object",
            "null"
          ],
          "required": [
            "declared",
            "url",
            "retrieved_at",
            "basis"
          ],
          "properties": {
            "declared": {
              "oneOf": [
                {
                  "type": "string"
                },
                {
                  "type": "array",
                  "minItems": 1,
                  "items": {
                    "type": "string"
                  }
                }
              ]
            },
            "url": {
              "type": "string",
              "format": "uri",
              "pattern": "^https://"
            },
            "retrieved_at": {
              "type": "string",
              "format": "date-time"
            },
            "basis": {
              "type": "string"
            }
          },
          "additionalProperties": false
        },
        "document": {
          "type": [
            "object",
            "null"
          ],
          "required": [
            "declared",
            "url",
            "retrieved_at",
            "basis"
          ],
          "properties": {
            "declared": {
              "oneOf": [
                {
                  "type": "string"
                },
                {
                  "type": "array",
                  "minItems": 1,
                  "items": {
                    "type": "string"
                  }
                }
              ]
            },
            "url": {
              "type": "string",
              "format": "uri",
              "pattern": "^https://"
            },
            "retrieved_at": {
              "type": "string",
              "format": "date-time"
            },
            "basis": {
              "type": "string"
            }
          },
          "additionalProperties": false
        }
      },
      "additionalProperties": false
    },
    "evidence": {
      "type": "array",
      "minItems": 1,
      "items": {
        "type": "object",
        "required": [
          "role",
          "method",
          "supports",
          "url",
          "retrieved_at",
          "sha256"
        ],
        "properties": {
          "role": {
            "const": "primary"
          },
          "method": {
            "enum": [
              "arxiv_api",
              "editorial_primary_review",
              "huggingface_api",
              "huggingface_card",
              "license_header"
            ]
          },
          "supports": {
            "type": "array",
            "items": {
              "type": "string"
            },
            "uniqueItems": true,
            "minItems": 1
          },
          "url": {
            "type": "string",
            "format": "uri",
            "pattern": "^https://"
          },
          "retrieved_at": {
            "type": "string",
            "format": "date-time"
          },
          "sha256": {
            "type": "string",
            "pattern": "^[0-9a-f]{64}$"
          }
        },
        "additionalProperties": false
      }
    },
    "last_verified_at": {
      "type": "string",
      "format": "date-time"
    },
    "notes": {
      "type": "string"
    },
    "details": {
      "type": "object"
    }
  },
  "additionalProperties": false
}
