{
  "aliases": [],
  "authors": [
    "Junqi Liu",
    "Yufan He",
    "Yexiao He",
    "Pengfei Guo",
    "Dong Yang",
    "Andriy Myronenko",
    "Can Zhao",
    "Hanrong Ye",
    "Tianhao Qi",
    "Yuyin Zhou",
    "Daguang Xu",
    "Yucheng Tang"
  ],
  "details": {
    "arxiv_snapshot": {
      "abstract_hash_method": "sha256-utf8-whitespace-collapsed-v1",
      "abstract_sha256": "a42e676ca2420ea1870ab6944bfcf35ebce98ecc12630e5f6fe186a220652932",
      "submitted_at": "2026-08-17T07:44:57Z",
      "updated_at": "2026-08-17T07:44:57Z",
      "version": 1,
      "versioned_url": "https://arxiv.org/abs/2608.16211v1"
    }
  },
  "environments": [
    "unspecified"
  ],
  "evidence": [
    {
      "method": "arxiv_api",
      "retrieved_at": "2026-10-17T12:31:35Z",
      "role": "primary",
      "sha256": "6499b4f4917eec0765d16d6e26a08d7edc5146a30753b19cf8218517656bb070",
      "supports": [
        "name",
        "authors",
        "published_at",
        "updated_at",
        "identifiers.arxiv",
        "details.arxiv_snapshot"
      ],
      "url": "https://export.arxiv.org/api/query?id_list=2608.16211%2C2608.16391%2C2608.17067%2C2608.17975%2C2608.19741%2C2608.21500%2C2608.22301%2C2608.22510%2C2608.23035%2C2608.23320%2C2608.26238%2C2608.26546%2C2608.26991%2C2608.27260%2C2608.29814%2C2608.31076%2C2609.02292%2C2609.04173%2C2609.04298%2C2609.05776%2C2609.06059%2C2609.07529%2C2609.08149%2C2609.08418%2C2609.09187%2C2609.11561%2C2609.12533%2C2609.15096%2C2609.15544%2C2609.20732%2C2609.21293%2C2609.23986%2C2609.24971%2C2609.24997%2C2609.27455%2C2609.29647%2C2609.29964%2C2609.30798%2C2609.32835%2C2609.34428%2C2609.35002%2C2609.35232%2C2609.35394%2C2609.35581%2C2609.36071%2C2609.36352%2C2609.36777%2C2609.37017%2C2609.38923%2C2609.39222&max_results=50"
    }
  ],
  "id": "arxiv:2608.16211",
  "identifiers": {
    "arxiv": "2608.16211"
  },
  "kind": "paper",
  "last_verified_at": "2026-10-17T12:31:35Z",
  "licenses": {
    "code": null,
    "data": null,
    "document": null,
    "weights": null
  },
  "links": [
    {
      "rel": "paper",
      "url": "https://arxiv.org/abs/2608.16211"
    }
  ],
  "name": "BaT: Towards Self-Evolving Medical Research Agent with Stage Rubrics",
  "notes": "Bibliographic metadata checked against arXiv. Relevance and taxonomy await editorial review; presence is not an endorsement.",
  "published_at": "2026-08-17",
  "relations": [],
  "review_status": "metadata_verified",
  "scope": "relevance_pending",
  "summary": null,
  "topics": [],
  "updated_at": "2026-08-17",
  "url": "https://arxiv.org/abs/2608.16211"
}
