{
  "aliases": [],
  "authors": [
    "Jiachen Zhu",
    "Lingyu Yang",
    "Rong Shan",
    "Congmin Zheng",
    "Zeyu Zheng",
    "Weiwen Liu",
    "Yong Yu",
    "Weinan Zhang",
    "Jianghao Lin"
  ],
  "details": {
    "arxiv_snapshot": {
      "abstract_hash_method": "sha256-utf8-whitespace-collapsed-v1",
      "abstract_sha256": "d756e951c214d59e782faad5f12b784b2bea431a2ca08ae907f68dc07d61b50f",
      "submitted_at": "2026-02-24T04:29:42Z",
      "updated_at": "2026-02-24T04:29:42Z",
      "version": 1,
      "versioned_url": "https://arxiv.org/abs/2604.09574v1"
    }
  },
  "environments": [
    "unspecified"
  ],
  "evidence": [
    {
      "method": "arxiv_api",
      "retrieved_at": "2026-10-16T06:36:43Z",
      "role": "primary",
      "sha256": "c432f419481a105a8ce71174ec4aea23c4f0d36ddf89cfe1d0974fa349f6cb59",
      "supports": [
        "name",
        "authors",
        "published_at",
        "updated_at",
        "identifiers.arxiv",
        "details.arxiv_snapshot"
      ],
      "url": "https://export.arxiv.org/api/query?search_query=%28ti%3A%22computer+use%22+OR+ti%3A%22computer-use%22+OR+ti%3A%22GUI+agent%22+OR+ti%3A%22GUI+agents%22+OR+ti%3A%22GUI+grounding%22+OR+ti%3A%22web+agents%22+OR+ti%3A%22browser+agent%22%29+AND+submittedDate%3A%5B200001010000+TO+202610160636%5D&start=400&max_results=100&sortBy=submittedDate&sortOrder=descending"
    }
  ],
  "id": "arxiv:2604.09574",
  "identifiers": {
    "arxiv": "2604.09574"
  },
  "kind": "paper",
  "last_verified_at": "2026-10-16T06:36:43Z",
  "licenses": {
    "code": null,
    "data": null,
    "document": null,
    "weights": null
  },
  "links": [
    {
      "rel": "paper",
      "url": "https://arxiv.org/abs/2604.09574"
    }
  ],
  "name": "Turing Test on Screen: A Benchmark for Mobile GUI Agent Humanization",
  "notes": "Bibliographic metadata checked against arXiv. Relevance and taxonomy await editorial review; presence is not an endorsement.",
  "published_at": "2026-02-24",
  "relations": [],
  "review_status": "metadata_verified",
  "scope": "relevance_pending",
  "summary": null,
  "topics": [],
  "updated_at": "2026-02-24",
  "url": "https://arxiv.org/abs/2604.09574"
}
