{
  "aliases": [],
  "authors": [
    "Ismaeel Al Ridhawi",
    "Moayad Aloqaily",
    "Yaser Jararweh"
  ],
  "details": {
    "arxiv_snapshot": {
      "abstract_hash_method": "sha256-utf8-whitespace-collapsed-v1",
      "abstract_sha256": "48e73cd9d3c058c01fca0ba5966816ed3ecab3a6a1555ad7ef3b4a82bbe5c1a2",
      "submitted_at": "2020-09-24T18:48:22Z",
      "updated_at": "2020-09-24T18:48:22Z",
      "version": 1,
      "versioned_url": "https://arxiv.org/abs/2009.11901v1"
    }
  },
  "environments": [
    "unspecified"
  ],
  "evidence": [
    {
      "method": "arxiv_api",
      "retrieved_at": "2026-10-16T06:37:05Z",
      "role": "primary",
      "sha256": "bb3d2692c294743a8d06d5065cc84b27b229a981c2c650ff20a2ec038797a0e3",
      "supports": [
        "name",
        "authors",
        "published_at",
        "updated_at",
        "identifiers.arxiv",
        "details.arxiv_snapshot"
      ],
      "url": "https://export.arxiv.org/api/query?search_query=%28ti%3A%22computer+use%22+OR+ti%3A%22computer-use%22+OR+ti%3A%22GUI+agent%22+OR+ti%3A%22GUI+agents%22+OR+ti%3A%22GUI+grounding%22+OR+ti%3A%22web+agents%22+OR+ti%3A%22browser+agent%22%29+AND+submittedDate%3A%5B200001010000+TO+202610160636%5D&start=1000&max_results=100&sortBy=submittedDate&sortOrder=descending"
    }
  ],
  "id": "arxiv:2009.11901",
  "identifiers": {
    "arxiv": "2009.11901"
  },
  "kind": "paper",
  "last_verified_at": "2026-10-16T06:37:05Z",
  "licenses": {
    "code": null,
    "data": null,
    "document": null,
    "weights": null
  },
  "links": [
    {
      "rel": "paper",
      "url": "https://arxiv.org/abs/2009.11901"
    }
  ],
  "name": "An Incentive-Based Mechanism for Volunteer Computing using Blockchain",
  "notes": "Bibliographic metadata checked against arXiv. Relevance and taxonomy await editorial review; presence is not an endorsement.",
  "published_at": "2020-09-24",
  "relations": [],
  "review_status": "metadata_verified",
  "scope": "relevance_pending",
  "summary": null,
  "topics": [],
  "updated_at": "2020-09-24",
  "url": "https://arxiv.org/abs/2009.11901"
}
