{
  "aliases": [],
  "authors": [
    "Junan Hu",
    "Jian Liu",
    "Jingxiang Lai",
    "Jiarui Hu",
    "Yiwei Sheng",
    "Shuang Chen",
    "Jian Li",
    "Dazhao Du",
    "Song Guo"
  ],
  "details": {
    "arxiv_snapshot": {
      "abstract_hash_method": "sha256-utf8-whitespace-collapsed-v1",
      "abstract_sha256": "b06f2787f7268d91820270502c5b6d68356a52a551da53c2cdd97fcacb7c1cc9",
      "submitted_at": "2026-04-30T14:51:49Z",
      "updated_at": "2026-04-30T14:51:49Z",
      "version": 1,
      "versioned_url": "https://arxiv.org/abs/2604.27955v1"
    }
  },
  "environments": [
    "unspecified"
  ],
  "evidence": [
    {
      "method": "arxiv_api",
      "retrieved_at": "2026-10-16T06:36:39Z",
      "role": "primary",
      "sha256": "27c33576ed43c7bc63d4b290f6558553bd1d3aa112a7358138f4045e1bc14918",
      "supports": [
        "name",
        "authors",
        "published_at",
        "updated_at",
        "identifiers.arxiv",
        "details.arxiv_snapshot"
      ],
      "url": "https://export.arxiv.org/api/query?search_query=%28ti%3A%22computer+use%22+OR+ti%3A%22computer-use%22+OR+ti%3A%22GUI+agent%22+OR+ti%3A%22GUI+agents%22+OR+ti%3A%22GUI+grounding%22+OR+ti%3A%22web+agents%22+OR+ti%3A%22browser+agent%22%29+AND+submittedDate%3A%5B200001010000+TO+202610160636%5D&start=300&max_results=100&sortBy=submittedDate&sortOrder=descending"
    }
  ],
  "id": "arxiv:2604.27955",
  "identifiers": {
    "arxiv": "2604.27955"
  },
  "kind": "paper",
  "last_verified_at": "2026-10-16T06:36:39Z",
  "licenses": {
    "code": null,
    "data": null,
    "document": null,
    "weights": null
  },
  "links": [
    {
      "rel": "paper",
      "url": "https://arxiv.org/abs/2604.27955"
    }
  ],
  "name": "GUI Agents with Reinforcement Learning: Toward Digital Inhabitants",
  "notes": "Bibliographic metadata checked against arXiv. Relevance and taxonomy await editorial review; presence is not an endorsement.",
  "published_at": "2026-04-30",
  "relations": [],
  "review_status": "metadata_verified",
  "scope": "relevance_pending",
  "summary": null,
  "topics": [],
  "updated_at": "2026-04-30",
  "url": "https://arxiv.org/abs/2604.27955"
}
