{
  "aliases": [],
  "authors": [
    "Xinglin Wang",
    "Zishen Liu",
    "Shaoxiong Feng",
    "Peiwen Yuan",
    "Yiwei Li",
    "Jiayi Shi",
    "Yueqi Zhang",
    "Chuyi Tan",
    "Ji Zhang",
    "Boyuan Pan",
    "Yao Hu",
    "Kan Li"
  ],
  "details": {
    "arxiv_snapshot": {
      "abstract_hash_method": "sha256-utf8-whitespace-collapsed-v1",
      "abstract_sha256": "f0d2b76136e6d05a1dc46e2ed305ba24c35038cb40a5c37d917bbc6a693e0314",
      "submitted_at": "2026-05-07T12:24:21Z",
      "updated_at": "2026-05-08T14:07:34Z",
      "version": 2,
      "versioned_url": "https://arxiv.org/abs/2605.06110v2"
    }
  },
  "environments": [
    "unspecified"
  ],
  "evidence": [
    {
      "method": "arxiv_api",
      "retrieved_at": "2026-10-17T12:31:19Z",
      "role": "primary",
      "sha256": "05ec5d668ac75d3d7c5b71ea7d6e76a3fbf5ebeb742e0843db2329e5e41aa208",
      "supports": [
        "name",
        "authors",
        "published_at",
        "updated_at",
        "identifiers.arxiv",
        "details.arxiv_snapshot"
      ],
      "url": "https://export.arxiv.org/api/query?id_list=2604.03598%2C2604.04759%2C2604.05547%2C2604.06170%2C2604.07340%2C2604.10547%2C2604.10938%2C2604.11978%2C2604.12282%2C2604.13018%2C2604.13346%2C2604.13954%2C2604.15579%2C2604.15671%2C2604.15715%2C2604.16520%2C2604.18240%2C2604.18934%2C2604.19572%2C2604.19667%2C2604.19742%2C2604.20841%2C2604.20987%2C2604.22436%2C2604.23781%2C2604.24479%2C2604.26148%2C2604.27621%2C2604.27996%2C2604.28093%2C2604.28139%2C2604.28181%2C2605.00425%2C2605.01462%2C2605.02240%2C2605.03042%2C2605.03242%2C2605.04811%2C2605.05191%2C2605.05811%2C2605.06110%2C2605.07073%2C2605.07358%2C2605.08374%2C2605.08985%2C2605.10912%2C2605.10966%2C2605.11363%2C2605.11732%2C2605.11817&max_results=50"
    }
  ],
  "id": "arxiv:2605.06110",
  "identifiers": {
    "arxiv": "2605.06110"
  },
  "kind": "paper",
  "last_verified_at": "2026-10-17T12:31:19Z",
  "licenses": {
    "code": null,
    "data": null,
    "document": null,
    "weights": null
  },
  "links": [
    {
      "rel": "paper",
      "url": "https://arxiv.org/abs/2605.06110"
    }
  ],
  "name": "On Time, Within Budget: Constraint-Driven Online Resource Allocation for Agentic Workflows",
  "notes": "Bibliographic metadata checked against arXiv. Relevance and taxonomy await editorial review; presence is not an endorsement.",
  "published_at": "2026-05-07",
  "relations": [],
  "review_status": "metadata_verified",
  "scope": "relevance_pending",
  "summary": null,
  "topics": [],
  "updated_at": "2026-05-08",
  "url": "https://arxiv.org/abs/2605.06110"
}
