{
  "aliases": [],
  "authors": [
    "Mingfei Lu",
    "Mengjia Wu",
    "Feng Liu",
    "Jiawei Xu",
    "Weikai Li",
    "Haoyang Wang",
    "Zhengdong Hu",
    "Ying Ding",
    "Yizhou Sun",
    "Jie Lu",
    "Yi Zhang"
  ],
  "details": {
    "arxiv_snapshot": {
      "abstract_hash_method": "sha256-utf8-whitespace-collapsed-v1",
      "abstract_sha256": "36b5621e54979becee17a4fc02fbd6402387acf1c023780a1fcf7c733d095c2c",
      "submitted_at": "2026-02-15T07:56:24Z",
      "updated_at": "2026-02-15T07:56:24Z",
      "version": 1,
      "versioned_url": "https://arxiv.org/abs/2602.14038v1"
    }
  },
  "environments": [
    "unspecified"
  ],
  "evidence": [
    {
      "method": "arxiv_api",
      "retrieved_at": "2026-10-17T12:31:12Z",
      "role": "primary",
      "sha256": "c8c95278aa5dcc6a8f2eda3f3b44d61ec1f35adcb6a4c6c9ab328691a1a4f102",
      "supports": [
        "name",
        "authors",
        "published_at",
        "updated_at",
        "identifiers.arxiv",
        "details.arxiv_snapshot"
      ],
      "url": "https://export.arxiv.org/api/query?id_list=2601.13462%2C2601.14232%2C2601.15331%2C2601.17548%2C2601.18418%2C2601.18491%2C2601.18827%2C2601.20171%2C2601.20613%2C2601.20742%2C2601.21233%2C2601.21253%2C2601.22037%2C2601.22154%2C2601.22511%2C2601.22607%2C2602.01550%2C2602.03117%2C2602.03361%2C2602.05665%2C2602.05746%2C2602.05877%2C2602.06052%2C2602.07398%2C2602.07458%2C2602.07918%2C2602.09007%2C2602.09463%2C2602.09514%2C2602.10122%2C2602.10525%2C2602.11224%2C2602.12268%2C2602.12430%2C2602.13318%2C2602.13543%2C2602.13692%2C2602.14038%2C2602.14337%2C2602.14364%2C2602.16313%2C2602.16317%2C2602.16666%2C2602.16901%2C2602.16930%2C2602.17547%2C2602.17646%2C2602.18846%2C2602.19320%2C2602.19594&max_results=50"
    }
  ],
  "id": "arxiv:2602.14038",
  "identifiers": {
    "arxiv": "2602.14038"
  },
  "kind": "paper",
  "last_verified_at": "2026-10-17T12:31:12Z",
  "licenses": {
    "code": null,
    "data": null,
    "document": null,
    "weights": null
  },
  "links": [
    {
      "rel": "paper",
      "url": "https://arxiv.org/abs/2602.14038"
    }
  ],
  "name": "Choosing How to Remember: Adaptive Memory Structures for LLM Agents",
  "notes": "Bibliographic metadata checked against arXiv. Relevance and taxonomy await editorial review; presence is not an endorsement.",
  "published_at": "2026-02-15",
  "relations": [],
  "review_status": "metadata_verified",
  "scope": "relevance_pending",
  "summary": null,
  "topics": [],
  "updated_at": "2026-02-15",
  "url": "https://arxiv.org/abs/2602.14038"
}
