{
  "aliases": [],
  "authors": [
    "Karan Gupta",
    "Pranav Vajreshwari",
    "Yash Pandya",
    "Raghav Magazine",
    "Akshay Nambi",
    "Ahmed Awadallah"
  ],
  "details": {
    "arxiv_snapshot": {
      "abstract_hash_method": "sha256-utf8-whitespace-collapsed-v1",
      "abstract_sha256": "85418b7430aabc8b1955d93f697c340467a7adc21f2386f349ca4362e4f9677d",
      "submitted_at": "2026-03-05T20:29:12Z",
      "updated_at": "2026-03-05T20:29:12Z",
      "version": 1,
      "versioned_url": "https://arxiv.org/abs/2603.06713v1"
    }
  },
  "environments": [
    "unspecified"
  ],
  "evidence": [
    {
      "method": "arxiv_api",
      "retrieved_at": "2026-10-17T12:31:16Z",
      "role": "primary",
      "sha256": "9289bc047b59e93f75703b72f5e92d9277e115238427519c343df550220e351b",
      "supports": [
        "name",
        "authors",
        "published_at",
        "updated_at",
        "identifiers.arxiv",
        "details.arxiv_snapshot"
      ],
      "url": "https://export.arxiv.org/api/query?id_list=2602.19870%2C2602.22769%2C2602.23166%2C2602.23320%2C2603.00198%2C2603.00842%2C2603.00991%2C2603.01050%2C2603.01145%2C2603.02236%2C2603.02795%2C2603.03278%2C2603.04549%2C2603.06713%2C2603.07106%2C2603.07670%2C2603.07853%2C2603.08706%2C2603.09716%2C2603.10002%2C2603.10664%2C2603.11139%2C2603.11320%2C2603.12483%2C2603.13026%2C2603.13247%2C2603.15714%2C2603.16065%2C2603.16289%2C2603.16839%2C2603.17216%2C2603.17378%2C2603.19313%2C2603.19685%2C2603.21489%2C2603.22527%2C2603.23638%2C2603.24157%2C2603.24639%2C2603.27646%2C2603.28069%2C2603.28407%2C2603.29418%2C2603.29847%2C2604.00528%2C2604.00886%2C2604.01194%2C2604.01438%2C2604.01560%2C2604.02985&max_results=50"
    }
  ],
  "id": "arxiv:2603.06713",
  "identifiers": {
    "arxiv": "2603.06713"
  },
  "kind": "paper",
  "last_verified_at": "2026-10-17T12:31:16Z",
  "licenses": {
    "code": null,
    "data": null,
    "document": null,
    "weights": null
  },
  "links": [
    {
      "rel": "paper",
      "url": "https://arxiv.org/abs/2603.06713"
    }
  ],
  "name": "Scaling Agentic Capabilities, Not Context: Efficient Reinforcement Finetuning for Large Toolspaces",
  "notes": "Bibliographic metadata checked against arXiv. Relevance and taxonomy await editorial review; presence is not an endorsement.",
  "published_at": "2026-03-05",
  "relations": [],
  "review_status": "metadata_verified",
  "scope": "relevance_pending",
  "summary": null,
  "topics": [],
  "updated_at": "2026-03-05",
  "url": "https://arxiv.org/abs/2603.06713"
}
