{
  "aliases": [],
  "authors": [
    "Xinrun Xu",
    "Yuxin Wang",
    "Chaoyi Xu",
    "Ziluo Ding",
    "Jiechuan Jiang",
    "Zhiming Ding",
    "Börje F. Karlsson"
  ],
  "details": {
    "arxiv_snapshot": {
      "abstract_hash_method": "sha256-utf8-whitespace-collapsed-v1",
      "abstract_sha256": "8497e90903223242fa595c853eec6eada92dc8833239d8e92f05517802712735",
      "submitted_at": "2024-03-15T12:37:12Z",
      "updated_at": "2024-03-15T12:37:12Z",
      "version": 1,
      "versioned_url": "https://arxiv.org/abs/2403.10249v1"
    }
  },
  "environments": [
    "unspecified"
  ],
  "evidence": [
    {
      "method": "arxiv_api",
      "retrieved_at": "2026-10-18T10:54:08Z",
      "role": "primary",
      "sha256": "00d275cd5407cec847fa9d43fe73cfc4384c5570b68a5e058c97921799be0bec",
      "supports": [
        "name",
        "authors",
        "published_at",
        "updated_at",
        "identifiers.arxiv",
        "details.arxiv_snapshot"
      ],
      "url": "https://export.arxiv.org/api/query?id_list=2302.01560%2C2303.16563%2C2305.15486%2C2305.16291%2C2305.17144%2C2306.00003%2C2306.00349%2C2306.17882%2C2310.01557%2C2310.08235%2C2310.08367%2C2311.05997%2C2311.17600%2C2312.02519%2C2312.11865%2C2402.01118%2C2402.10196%2C2402.11208%2C2403.10249%2C2403.12037%2C2404.06647%2C2404.12241%2C2404.13246%2C2407.15325%2C2409.00138%2C2410.14573%2C2410.18927%2C2410.19012%2C2411.09523%2C2411.10349%2C2411.13543%2C2412.01547%2C2501.05366%2C2501.09004%2C2502.07463%2C2502.14538%2C2503.02732%2C2503.08175%2C2503.11387%2C2504.10147%2C2504.11703%2C2504.14064%2C2504.15810%2C2504.16208%2C2504.20635%2C2504.21776%2C2505.12981%2C2505.13076%2C2506.01616%2C2506.13205&max_results=50"
    }
  ],
  "id": "arxiv:2403.10249",
  "identifiers": {
    "arxiv": "2403.10249"
  },
  "kind": "paper",
  "last_verified_at": "2026-10-18T10:54:08Z",
  "licenses": {
    "code": null,
    "data": null,
    "document": null,
    "weights": null
  },
  "links": [
    {
      "rel": "paper",
      "url": "https://arxiv.org/abs/2403.10249"
    }
  ],
  "name": "A Survey on Game Playing Agents and Large Models: Methods, Applications, and Challenges",
  "notes": "Bibliographic metadata checked against arXiv. Relevance and taxonomy await editorial review; presence is not an endorsement.",
  "published_at": "2024-03-15",
  "relations": [],
  "review_status": "metadata_verified",
  "scope": "relevance_pending",
  "summary": null,
  "topics": [],
  "updated_at": "2024-03-15",
  "url": "https://arxiv.org/abs/2403.10249"
}
