{
  "aliases": [],
  "authors": [
    "Yuntong Zhang",
    "Haifeng Ruan",
    "Zhiyu Fan",
    "Abhik Roychoudhury"
  ],
  "details": {
    "arxiv_snapshot": {
      "abstract_hash_method": "sha256-utf8-whitespace-collapsed-v1",
      "abstract_sha256": "a0332cfb0909325d94b5c927a0821873f32680a4f638119cd137a6251326203d",
      "submitted_at": "2024-04-08T11:55:09Z",
      "updated_at": "2024-07-25T16:54:41Z",
      "version": 3,
      "versioned_url": "https://arxiv.org/abs/2404.05427v3"
    }
  },
  "environments": [
    "unspecified"
  ],
  "evidence": [
    {
      "method": "arxiv_api",
      "retrieved_at": "2026-10-16T06:31:28Z",
      "role": "primary",
      "sha256": "be244bfae7f89ef9449b69d85aac44295eb7b5f7e5e1bbedd76df312696676a7",
      "supports": [
        "name",
        "authors",
        "published_at",
        "updated_at",
        "identifiers.arxiv",
        "details.arxiv_snapshot"
      ],
      "url": "https://export.arxiv.org/api/query?id_list=2403.03186%2C2403.03788%2C2403.07718%2C2403.10170%2C2403.11905%2C2403.16971%2C2403.17918%2C2403.20271%2C2404.01549%2C2404.01744%2C2404.02475%2C2404.03648%2C2404.05427%2C2404.05719%2C2404.05955%2C2404.06474%2C2404.07972%2C2404.08755%2C2404.08860%2C2404.08948%2C2404.09992%2C2404.10887%2C2404.11459%2C2404.16006%2C2404.16048%2C2404.16054%2C2404.16660%2C2404.18074%2C2404.19296%2C2405.00516%2C2405.11120%2C2405.12842%2C2405.14573%2C2405.14751%2C2405.15793%2C2405.16247%2C2405.20309%2C2406.01014%2C2406.01623%2C2406.03679%2C2406.06947%2C2406.07822%2C2406.08184%2C2406.08340%2C2406.08451%2C2406.10227%2C2406.10819%2C2406.11317%2C2406.11896%2C2406.12373&max_results=50"
    }
  ],
  "id": "arxiv:2404.05427",
  "identifiers": {
    "arxiv": "2404.05427"
  },
  "kind": "paper",
  "last_verified_at": "2026-10-16T06:31:28Z",
  "licenses": {
    "code": null,
    "data": null,
    "document": null,
    "weights": null
  },
  "links": [
    {
      "rel": "paper",
      "url": "https://arxiv.org/abs/2404.05427"
    }
  ],
  "name": "AutoCodeRover: Autonomous Program Improvement",
  "notes": "Bibliographic metadata checked against arXiv. Relevance and taxonomy await editorial review; presence is not an endorsement.",
  "published_at": "2024-04-08",
  "relations": [],
  "review_status": "metadata_verified",
  "scope": "relevance_pending",
  "summary": null,
  "topics": [],
  "updated_at": "2024-07-25",
  "url": "https://arxiv.org/abs/2404.05427"
}
