{
  "aliases": [],
  "authors": [
    "Renan Souza",
    "Amal Gueroudji",
    "Stephen DeWitt",
    "Daniel Rosendo",
    "Tirthankar Ghosal",
    "Robert Ross",
    "Prasanna Balaprakash",
    "Rafael Ferreira da Silva"
  ],
  "details": {
    "arxiv_snapshot": {
      "abstract_hash_method": "sha256-utf8-whitespace-collapsed-v1",
      "abstract_sha256": "080c0698091725ed812c2dccb717a86907987dba3e5dd9c24f11eaa049d50eb8",
      "submitted_at": "2025-08-04T19:54:40Z",
      "updated_at": "2025-08-20T15:00:50Z",
      "version": 3,
      "versioned_url": "https://arxiv.org/abs/2508.02866v3"
    }
  },
  "environments": [
    "unspecified"
  ],
  "evidence": [
    {
      "method": "arxiv_api",
      "retrieved_at": "2026-10-17T07:57:51Z",
      "role": "primary",
      "sha256": "b91987360225499418fcd3645d7d5effac91e8202bf7c7e17c9f9e31d25b5be8",
      "supports": [
        "name",
        "authors",
        "published_at",
        "updated_at",
        "identifiers.arxiv",
        "details.arxiv_snapshot"
      ],
      "url": "https://export.arxiv.org/api/query?id_list=2506.01423%2C2506.03231%2C2506.04301%2C2506.05336%2C2506.07385%2C2506.07398%2C2506.08136%2C2506.08837%2C2506.10953%2C2506.11425%2C2506.11763%2C2506.13538%2C2506.14683%2C2506.15461%2C2506.18959%2C2506.19502%2C2506.20668%2C2506.21252%2C2506.21495%2C2506.21614%2C2507.01599%2C2507.02279%2C2507.02825%2C2507.04036%2C2507.07400%2C2507.09481%2C2507.09884%2C2507.13348%2C2507.14447%2C2507.16704%2C2507.19902%2C2507.21678%2C2507.22925%2C2508.01548%2C2508.02866%2C2508.04002%2C2508.04389%2C2508.05193%2C2508.05294%2C2508.05748%2C2508.07871%2C2508.07999%2C2508.08228%2C2508.09124%2C2508.09981%2C2508.15804%2C2508.16153%2C2508.17398%2C2508.18489%2C2508.19611&max_results=50"
    }
  ],
  "id": "arxiv:2508.02866",
  "identifiers": {
    "arxiv": "2508.02866"
  },
  "kind": "paper",
  "last_verified_at": "2026-10-17T07:57:51Z",
  "licenses": {
    "code": null,
    "data": null,
    "document": null,
    "weights": null
  },
  "links": [
    {
      "rel": "paper",
      "url": "https://arxiv.org/abs/2508.02866"
    }
  ],
  "name": "PROV-AGENT: Unified Provenance for Tracking AI Agent Interactions in Agentic Workflows",
  "notes": "Bibliographic metadata checked against arXiv. Relevance and taxonomy await editorial review; presence is not an endorsement.",
  "published_at": "2025-08-04",
  "relations": [],
  "review_status": "metadata_verified",
  "scope": "relevance_pending",
  "summary": null,
  "topics": [],
  "updated_at": "2025-08-20",
  "url": "https://arxiv.org/abs/2508.02866"
}
