{
  "aliases": [],
  "authors": [
    "Xuhao Hu",
    "Xi Zhang",
    "Haiyang Xu",
    "Kyle Qiao",
    "Jingyi Yang",
    "Xuanjing Huang",
    "Jing Shao",
    "Ming Yan",
    "Jieping Ye"
  ],
  "details": {
    "arxiv_snapshot": {
      "abstract_hash_method": "sha256-utf8-whitespace-collapsed-v1",
      "abstract_sha256": "09128e90b925ac0cd2cf6e967853180bbef1e97a0960c22065f1b0b50c30d58b",
      "submitted_at": "2026-05-12T17:57:04Z",
      "updated_at": "2026-09-19T14:53:46Z",
      "version": 2,
      "versioned_url": "https://arxiv.org/abs/2605.12481v2"
    }
  },
  "environments": [
    "unspecified"
  ],
  "evidence": [
    {
      "method": "arxiv_api",
      "retrieved_at": "2026-10-16T06:36:39Z",
      "role": "primary",
      "sha256": "27c33576ed43c7bc63d4b290f6558553bd1d3aa112a7358138f4045e1bc14918",
      "supports": [
        "name",
        "authors",
        "published_at",
        "updated_at",
        "identifiers.arxiv",
        "details.arxiv_snapshot"
      ],
      "url": "https://export.arxiv.org/api/query?search_query=%28ti%3A%22computer+use%22+OR+ti%3A%22computer-use%22+OR+ti%3A%22GUI+agent%22+OR+ti%3A%22GUI+agents%22+OR+ti%3A%22GUI+grounding%22+OR+ti%3A%22web+agents%22+OR+ti%3A%22browser+agent%22%29+AND+submittedDate%3A%5B200001010000+TO+202610160636%5D&start=300&max_results=100&sortBy=submittedDate&sortOrder=descending"
    }
  ],
  "id": "arxiv:2605.12481",
  "identifiers": {
    "arxiv": "2605.12481"
  },
  "kind": "paper",
  "last_verified_at": "2026-10-16T06:36:39Z",
  "licenses": {
    "code": null,
    "data": null,
    "document": null,
    "weights": null
  },
  "links": [
    {
      "rel": "paper",
      "url": "https://arxiv.org/abs/2605.12481"
    }
  ],
  "name": "ToolCUA: Towards Optimal GUI-Tool Path Orchestration for Computer Use Agents",
  "notes": "Bibliographic metadata checked against arXiv. Relevance and taxonomy await editorial review; presence is not an endorsement.",
  "published_at": "2026-05-12",
  "relations": [],
  "review_status": "metadata_verified",
  "scope": "relevance_pending",
  "summary": null,
  "topics": [],
  "updated_at": "2026-09-19",
  "url": "https://arxiv.org/abs/2605.12481"
}
