{
  "aliases": [],
  "authors": [],
  "details": {
    "disabled": false,
    "download_url": "https://huggingface.co/OpenGVLab/ScaleCUA-7B/tree/main",
    "gated": false,
    "hub_id": "OpenGVLab/ScaleCUA-7B"
  },
  "environments": [
    "web",
    "desktop",
    "android",
    "linux"
  ],
  "evidence": [
    {
      "method": "editorial_primary_review",
      "retrieved_at": "2026-10-17T02:45:20Z",
      "role": "primary",
      "sha256": "e45116466b8b9ef3e93992a1efca8fa5b921a8b041297933210c9f552767ffb8",
      "supports": [
        "name",
        "kind",
        "summary",
        "environments",
        "topics",
        "scope",
        "relations",
        "details"
      ],
      "url": "https://huggingface.co/OpenGVLab/ScaleCUA-7B/raw/main/README.md"
    },
    {
      "method": "editorial_primary_review",
      "retrieved_at": "2026-10-17T02:45:19Z",
      "role": "primary",
      "sha256": "bad2617fd64633212a30b78d99fb053a662378ab50b42722a04af4104ac2248f",
      "supports": [
        "identity",
        "release_status",
        "details",
        "licenses.weights"
      ],
      "url": "https://huggingface.co/api/models/OpenGVLab/ScaleCUA-7B"
    },
    {
      "method": "editorial_primary_review",
      "retrieved_at": "2026-10-17T01:54:55Z",
      "role": "primary",
      "sha256": "0538701c860afedd5d63c3839039699d8e5a14977d5c339b187ed13ad666c8fa",
      "supports": [
        "environments",
        "relations"
      ],
      "url": "https://raw.githubusercontent.com/OpenGVLab/ScaleCUA/HEAD/README.md"
    },
    {
      "method": "huggingface_card",
      "retrieved_at": "2026-10-17T02:45:20Z",
      "role": "primary",
      "sha256": "e45116466b8b9ef3e93992a1efca8fa5b921a8b041297933210c9f552767ffb8",
      "supports": [
        "licenses.weights"
      ],
      "url": "https://huggingface.co/OpenGVLab/ScaleCUA-7B/raw/main/README.md"
    }
  ],
  "id": "url:ff7b1873a3eead89607a",
  "identifiers": {},
  "kind": "model",
  "last_verified_at": "2026-10-17T02:45:20Z",
  "licenses": {
    "code": null,
    "data": null,
    "document": null,
    "weights": {
      "basis": "publisher model/dataset card metadata; third-party assets retain their own terms",
      "declared": "apache-2.0",
      "retrieved_at": "2026-10-17T02:45:20Z",
      "url": "https://huggingface.co/OpenGVLab/ScaleCUA-7B/raw/main/README.md"
    }
  },
  "links": [
    {
      "rel": "primary",
      "url": "https://huggingface.co/OpenGVLab/ScaleCUA-7B"
    }
  ],
  "name": "ScaleCUA 7B",
  "notes": "Four public safetensors shards and model/tokenizer configuration are present. The card declares Apache-2.0. The model card’s Paper link points to the code repository, so the arXiv association uses the repository’s explicit citation rather than treating that link as a paper URL.",
  "published_at": null,
  "relations": [
    {
      "evidence_url": "https://raw.githubusercontent.com/OpenGVLab/ScaleCUA/HEAD/README.md",
      "target_id": "arxiv:2509.15221",
      "type": "documented_by"
    }
  ],
  "review_status": "curated",
  "scope": "core",
  "summary": "A Qwen2.5-VL-based computer-use checkpoint with direct grounding and agent action modes across desktop, mobile and web interfaces.",
  "topics": [
    "grounding",
    "action-prediction",
    "planning"
  ],
  "updated_at": null,
  "url": "https://huggingface.co/OpenGVLab/ScaleCUA-7B"
}
