{
  "aliases": [],
  "authors": [
    "Henry Peng Zou",
    "Chunyu Miao",
    "Wei-Chieh Huang",
    "Yankai Chen",
    "Yue Zhou",
    "Hanrong Zhang",
    "Yaozu Wu",
    "Liancheng Fang",
    "Zhengyao Gu",
    "Zhen Zhang",
    "Kening Zheng",
    "Fangxin Wang",
    "Yi Nian",
    "Shanghao Li",
    "Wenzhe Fan",
    "Langzhou He",
    "Weizhi Zhang",
    "Xue Liu",
    "Philip S. Yu"
  ],
  "details": {
    "arxiv_snapshot": {
      "abstract_hash_method": "sha256-utf8-whitespace-collapsed-v1",
      "abstract_sha256": "ad47ef265807999774de6f3098a7f8b52379543200a84b4a41e216e2c788b54c",
      "submitted_at": "2026-04-01T13:40:28Z",
      "updated_at": "2026-04-01T13:40:28Z",
      "version": 1,
      "versioned_url": "https://arxiv.org/abs/2604.00892v1"
    }
  },
  "environments": [
    "unspecified"
  ],
  "evidence": [
    {
      "method": "arxiv_api",
      "retrieved_at": "2026-10-16T06:33:02Z",
      "role": "primary",
      "sha256": "e436adf2735cb537ee4b24aa0c3f36930a50c2f683cc6868e7c40df602bdb6b8",
      "supports": [
        "name",
        "authors",
        "published_at",
        "updated_at",
        "identifiers.arxiv",
        "details.arxiv_snapshot"
      ],
      "url": "https://export.arxiv.org/api/query?id_list=2604.00892%2C2604.01221%2C2604.01676%2C2604.02345%2C2604.03465%2C2604.05157%2C2604.06134%2C2604.06240%2C2604.06995%2C2604.07277%2C2604.07831%2C2604.07929%2C2604.08005%2C2604.09581%2C2604.10261%2C2604.10577%2C2604.10988%2C2604.11201%2C2604.18847%2C2604.21375%2C2604.24441%2C2604.26020%2C2605.00551%2C2605.02168%2C2605.07505%2C2605.10347%2C2605.12294%2C2605.15040%2C2605.16883%2C2605.27134%2C2605.28258%2C2606.01790%2C2606.02031%2C2606.02208%2C2606.03203%2C2606.03236%2C2606.03951%2C2606.04391%2C2606.04627%2C2606.04701%2C2606.05233%2C2606.05597%2C2606.05697%2C2606.06560%2C2606.06708%2C2606.07027%2C2606.07074%2C2606.09399%2C2606.09447%2C2606.09764&max_results=50"
    }
  ],
  "id": "arxiv:2604.00892",
  "identifiers": {
    "arxiv": "2604.00892"
  },
  "kind": "paper",
  "last_verified_at": "2026-10-16T06:33:02Z",
  "licenses": {
    "code": null,
    "data": null,
    "document": null,
    "weights": null
  },
  "links": [
    {
      "rel": "paper",
      "url": "https://arxiv.org/abs/2604.00892"
    }
  ],
  "name": "When Users Change Their Mind: Evaluating Interruptible Agents in Long-Horizon Web Navigation",
  "notes": "Bibliographic metadata checked against arXiv. Relevance and taxonomy await editorial review; presence is not an endorsement.",
  "published_at": "2026-04-01",
  "relations": [],
  "review_status": "metadata_verified",
  "scope": "relevance_pending",
  "summary": null,
  "topics": [],
  "updated_at": "2026-04-01",
  "url": "https://arxiv.org/abs/2604.00892"
}
