{
  "aliases": [],
  "authors": [
    "Yingqi Zhang"
  ],
  "details": {
    "arxiv_snapshot": {
      "abstract_hash_method": "sha256-utf8-whitespace-collapsed-v1",
      "abstract_sha256": "fc55e544d43ae80db777d5ccc1b151ecadc6bc61a1fca735390529f68251fbff",
      "submitted_at": "2026-06-02T16:53:24Z",
      "updated_at": "2026-08-18T06:50:39Z",
      "version": 3,
      "versioned_url": "https://arxiv.org/abs/2606.03895v3"
    }
  },
  "environments": [
    "unspecified"
  ],
  "evidence": [
    {
      "method": "arxiv_api",
      "retrieved_at": "2026-10-17T12:31:23Z",
      "role": "primary",
      "sha256": "9a71e95803ce58c462c84e2b45a891555e31d1fb409e643bb3ca4675a44c96e6",
      "supports": [
        "name",
        "authors",
        "published_at",
        "updated_at",
        "identifiers.arxiv",
        "details.arxiv_snapshot"
      ],
      "url": "https://export.arxiv.org/api/query?id_list=2605.12233%2C2605.12493%2C2605.12978%2C2605.13119%2C2605.14133%2C2605.16909%2C2605.17260%2C2605.17324%2C2605.17448%2C2605.17656%2C2605.17721%2C2605.19447%2C2605.19587%2C2605.20894%2C2605.22642%2C2605.23204%2C2605.25233%2C2605.25901%2C2605.26086%2C2605.26144%2C2605.26252%2C2605.26646%2C2605.27209%2C2605.27705%2C2605.27898%2C2605.28158%2C2605.28255%2C2605.29341%2C2605.29463%2C2605.29801%2C2605.30010%2C2605.30052%2C2605.30126%2C2605.30434%2C2605.30907%2C2605.30914%2C2605.31264%2C2605.31557%2C2606.00530%2C2606.00543%2C2606.00856%2C2606.01057%2C2606.01961%2C2606.02540%2C2606.03103%2C2606.03889%2C2606.03895%2C2606.04315%2C2606.04455%2C2606.05525&max_results=50"
    }
  ],
  "id": "arxiv:2606.03895",
  "identifiers": {
    "arxiv": "2606.03895"
  },
  "kind": "paper",
  "last_verified_at": "2026-10-17T12:31:23Z",
  "licenses": {
    "code": null,
    "data": null,
    "document": null,
    "weights": null
  },
  "links": [
    {
      "rel": "paper",
      "url": "https://arxiv.org/abs/2606.03895"
    }
  ],
  "name": "Agent libOS: A Runtime Substrate for Capability-Controlled Self-Evolving LLM Agents",
  "notes": "Bibliographic metadata checked against arXiv. Relevance and taxonomy await editorial review; presence is not an endorsement.",
  "published_at": "2026-06-02",
  "relations": [],
  "review_status": "metadata_verified",
  "scope": "relevance_pending",
  "summary": null,
  "topics": [],
  "updated_at": "2026-08-18",
  "url": "https://arxiv.org/abs/2606.03895"
}
