{
  "aliases": [],
  "authors": [],
  "details": {},
  "environments": [
    "cross-platform"
  ],
  "evidence": [
    {
      "method": "editorial_primary_review",
      "retrieved_at": "2026-10-16T06:36:00Z",
      "role": "primary",
      "sha256": "a0609394a736dc495d077cd57a2945b018123e5b3f9514d7d5bafb9e690aeae2",
      "supports": [
        "name",
        "kind",
        "summary",
        "environments",
        "topics",
        "scope",
        "relations"
      ],
      "url": "https://raw.githubusercontent.com/microsoft/Phi-Ground/HEAD/README.md"
    },
    {
      "method": "license_header",
      "retrieved_at": "2026-10-16T06:42:00Z",
      "role": "primary",
      "sha256": "c2cfccb812fe482101a8f04597dfc5a9991a6b2748266c47ac91b6a5aae15383",
      "supports": [
        "licenses.code"
      ],
      "url": "https://raw.githubusercontent.com/microsoft/Phi-Ground/HEAD/LICENSE"
    }
  ],
  "id": "github:microsoft/phi-ground",
  "identifiers": {},
  "kind": "model",
  "last_verified_at": "2026-10-16T06:36:00Z",
  "licenses": {
    "code": {
      "basis": "repository LICENSE header; not a weights/data license",
      "declared": "MIT",
      "retrieved_at": "2026-10-16T06:42:00Z",
      "url": "https://raw.githubusercontent.com/microsoft/Phi-Ground/HEAD/LICENSE"
    },
    "data": null,
    "document": null,
    "weights": null
  },
  "links": [
    {
      "rel": "primary",
      "url": "https://github.com/microsoft/Phi-Ground"
    }
  ],
  "name": "Phi-Ground",
  "notes": "",
  "published_at": null,
  "relations": [
    {
      "evidence_url": "https://raw.githubusercontent.com/microsoft/Phi-Ground/HEAD/README.md",
      "target_id": "arxiv:2507.23779",
      "type": "documented_by"
    }
  ],
  "review_status": "curated",
  "scope": "core",
  "summary": "GUI grounding model and associated evaluation resources.",
  "topics": [
    "grounding"
  ],
  "updated_at": null,
  "url": "https://github.com/microsoft/Phi-Ground"
}
