{
  "aliases": [],
  "authors": [
    "Hongxin Li",
    "Jingran Su",
    "Jingfan Chen",
    "Zheng Ju",
    "Yuntao Chen",
    "Qing Li",
    "Zhaoxiang Zhang"
  ],
  "details": {
    "arxiv_snapshot": {
      "abstract_hash_method": "sha256-utf8-whitespace-collapsed-v1",
      "abstract_sha256": "97b7c0690ba7deb7dbbdac6ac94dd82e3864c440cb4325bf143ad735919bb08b",
      "submitted_at": "2025-09-22T03:04:53Z",
      "updated_at": "2025-09-22T03:04:53Z",
      "version": 1,
      "versioned_url": "https://arxiv.org/abs/2509.17328v1"
    }
  },
  "environments": [
    "cross-platform"
  ],
  "evidence": [
    {
      "method": "arxiv_api",
      "retrieved_at": "2026-10-16T06:36:50Z",
      "role": "primary",
      "sha256": "26fb4922c4c0bb5c9069935ed0aef0a9f56938cf8ae1af9724894fa1409955fb",
      "supports": [
        "name",
        "authors",
        "published_at",
        "updated_at",
        "identifiers.arxiv",
        "details.arxiv_snapshot"
      ],
      "url": "https://export.arxiv.org/api/query?search_query=%28ti%3A%22computer+use%22+OR+ti%3A%22computer-use%22+OR+ti%3A%22GUI+agent%22+OR+ti%3A%22GUI+agents%22+OR+ti%3A%22GUI+grounding%22+OR+ti%3A%22web+agents%22+OR+ti%3A%22browser+agent%22%29+AND+submittedDate%3A%5B200001010000+TO+202610160636%5D&start=600&max_results=100&sortBy=submittedDate&sortOrder=descending"
    },
    {
      "method": "editorial_primary_review",
      "retrieved_at": "2026-10-16T06:36:50Z",
      "role": "primary",
      "sha256": "26fb4922c4c0bb5c9069935ed0aef0a9f56938cf8ae1af9724894fa1409955fb",
      "supports": [
        "name",
        "kind",
        "summary",
        "environments",
        "topics",
        "scope",
        "relations"
      ],
      "url": "https://export.arxiv.org/api/query?search_query=%28ti%3A%22computer+use%22+OR+ti%3A%22computer-use%22+OR+ti%3A%22GUI+agent%22+OR+ti%3A%22GUI+agents%22+OR+ti%3A%22GUI+grounding%22+OR+ti%3A%22web+agents%22+OR+ti%3A%22browser+agent%22%29+AND+submittedDate%3A%5B200001010000+TO+202610160636%5D&start=600&max_results=100&sortBy=submittedDate&sortOrder=descending"
    }
  ],
  "id": "arxiv:2509.17328",
  "identifiers": {
    "arxiv": "2509.17328"
  },
  "kind": "paper",
  "last_verified_at": "2026-10-16T06:36:50Z",
  "licenses": {
    "code": null,
    "data": null,
    "document": null,
    "weights": null
  },
  "links": [
    {
      "rel": "primary",
      "url": "https://arxiv.org/abs/2509.17328"
    }
  ],
  "name": "UIPro: Unleashing Superior Interaction Capability For GUI Agents",
  "notes": "The annotation and scope were reviewed against the primary paper abstract. Experimental results and released artifacts have not been independently reproduced.",
  "published_at": "2025-09-22",
  "relations": [],
  "review_status": "curated",
  "scope": "core",
  "summary": "UIPro pretrains GUI understanding on 20.6 million tasks and then harmonizes interaction datasets through a unified action space. Continued fine-tuning uses the merged multi-platform data to train action prediction for generalist GUI operation.",
  "topics": [
    "data-generation",
    "action-prediction",
    "grounding",
    "imitation-learning"
  ],
  "updated_at": "2025-09-22",
  "url": "https://arxiv.org/abs/2509.17328"
}
